{
  "ctime": "2019-12-03T10:41:33.326684Z",
  "id": 2,
  "organization": {
    "id": 4,
    "name": "docs-validator"
  },
  "release": {
    "changes": "",
    "id": 27,
    "release_ver": "R#920659",
    "unreal_ver": "0.07972693815579912"
  },
  "uid": "1_CL2_MRSZwpQk}y^‾3nYtjG7|DfNsOxeH.qlVi8I9!:1rEhcBX]bz6-K[gL$5mv",
  "url": ""
}