[
  {
    "ctime": "2019-12-03T10:33:01.624936Z",
    "id": 1,
    "organization": {
      "id": 4,
      "name": "docs-validator"
    },
    "release": {
      "changes": "",
      "id": 26,
      "release_ver": "R#292163",
      "unreal_ver": "0.2939398293292702"
    },
    "uid": "4_0.2939398293292702_R#292163_OLfwdIPU6~D08opGNqSZsX7J2nCk.WmzHA",
    "url": ""
  },
  {
    "ctime": "2019-12-03T10:41:33.326684Z",
    "id": 2,
    "organization": {
      "id": 4,
      "name": "docs-validator"
    },
    "release": {
      "changes": "",
      "id": 27,
      "release_ver": "R#920659",
      "unreal_ver": "0.07972693815579912"
    },
    "uid": "",
    "url": ""
  }
]